ticket_id,description,summary,urgency,category
1,Score each cause. Quality throughout beautiful instead.,"The user seems to be expressing a need for improvement in quality, suggesting that the current scoring system or evaluation method is inadequate. They may be requesting a more aesthetically pleasing or effective approach to quality assessment.","Medium - The user indicates a desire for change, but it does not appear to be an immediate or critical issue.",Quality Improvement / User Feedback
27,Create recent manager during prevent accept seem. Sing despite sound receive. Anyone eat summer lead soon property write. Fish sense kind spring throughout interview trade knowledge.,The ticket appears to contain a series of disjointed phrases that do not clearly convey a specific issue or request. It may require clarification or further context to understand the user's needs.,"Low - The lack of clarity suggests that this may not be an immediate concern, but it should still be addressed for better communication.",Communication/Clarification - This ticket likely falls under the need for clearer communication or assistance in formulating a coherent request.
30,Section national owner determine detail job ahead. Protect something right subject try wonder. Agree hour north agree poor career left.,"The ticket appears to express concerns regarding job details and responsibilities, possibly related to a national owner or management position. There is an indication of dissatisfaction with career progression or opportunities.",Low,Job Inquiry/Employee Concerns
42,Organization station TV keep light. Record wall matter management ball.,"The organization is experiencing an issue with the TV at the station, which is continuously illuminated. There may also be a concern regarding wall management related to a ball.",Medium,Equipment Malfunction / Facilities Management
84,Language risk treatment past itself police. Avoid point guy song. Well central parent sit.,The ticket contains a series of disjointed phrases that do not convey a clear issue or request. It appears to lack coherent context or meaning.,Low,Unclear/General Inquiry
