ticket_id,description,summary,urgency,category
1,Score each cause. Quality throughout beautiful instead.,"The ticket seems to express a desire for a shift in focus from scoring each cause to ensuring quality throughout a process or product, indicating a preference for overall excellence rather than individual evaluations.","Medium - The request suggests a change in approach that may require attention, but it does not indicate an immediate issue or crisis.",Process Improvement - The ticket relates to enhancing the quality of work or outputs rather than addressing a specific technical problem or support issue.
2,Measure ago current practice nation. Last everything thank serve civil.,The ticket appears to be a fragmented message that lacks clear context or specific details. It may relate to a request for information or feedback regarding current practices in a civil service context.,Low - The message does not indicate any immediate issues or urgent needs.,General Inquiry - The ticket seems to fall under general inquiries or requests for information rather than a specific technical issue or service request.
4,Stop peace technology officer relate. Product significant world. Term herself law street class.,"The ticket appears to express a concern or request regarding the role of a technology officer in relation to peace, mentioning the significance of a product and referencing legal and social aspects, though the message is somewhat unclear.",Low (the message lacks specific details indicating immediate urgency).,General Inquiry/Feedback.
8,Edge network wall quite boy those seem. Born itself law west then enjoy. Seven medical blood personal success medical current.,The ticket contains a series of disjointed phrases that do not convey a clear issue or request. It appears to be nonsensical or possibly a result of a miscommunication.,Low,Miscellaneous / Unclear Issue
10,Campaign little near enter. Institution deep much role cut find yet practice. Tonight later easy ask again network.,"The ticket contains vague and unclear statements regarding a campaign and a network-related issue, suggesting a need for further clarification or assistance.",Low,General Inquiry / Clarification Needed
13,Movie cell contain leg themselves. Kitchen technology nearly anything.,"The ticket appears to contain nonsensical phrases and lacks clear context, making it difficult to determine the specific issue being reported.","Low, as the content does not indicate an immediate problem or concern.",Miscellaneous/Unclear Issue.
17,Enter capital population lead upon. Act perform none beyond. Defense enter value thing these hard citizen.,The ticket appears to be a collection of fragmented phrases that do not convey a clear issue or request. It may require further clarification from the user to understand the specific problem or task they are referring to.,Low - The lack of clarity suggests that this ticket is not urgent and may need additional information before it can be addressed.,"General Inquiry - Since the ticket does not specify a particular issue or category, it can be classified as a general inquiry pending further details."
18,Worker southern more property never use billion there. Break blood network evening painting.,The ticket contains unclear and disjointed phrases that do not convey a specific issue or request. It appears to lack coherent context or actionable information.,Low - The ticket does not present any immediate or critical issues that require urgent attention.,"Miscellaneous - The content does not fit into standard support categories such as technical issues, billing inquiries, or service requests."
24,Mind southern rather. Hair attorney professional form finish. Rest feel finally impact.,"The ticket appears to be a collection of disjointed phrases that do not convey a clear issue or request. It mentions ""southern,"" ""hair,"" ""attorney,"" and ""impact,"" but lacks coherent context.",Low. The ticket does not present a clear problem or urgency that requires immediate attention.,Miscellaneous/Unclear. The content does not fit into a specific support category due to its vague and fragmented nature.
25,Camera inside wait quality total past feeling. Street fight decision size parent focus kid.,"The ticket appears to express concerns about the quality of a camera, possibly related to a situation involving a street fight and its impact on a child. The mention of ""parent focus"" suggests a need for parental guidance or concern regarding the child's exposure to violence.","Medium - The mention of a street fight and its potential impact on a child indicates a need for timely attention, but it is not an immediate emergency.","Safety/Quality Concern - This ticket relates to safety issues regarding children and the quality of a camera, possibly for monitoring or recording purposes."
27,Create recent manager during prevent accept seem. Sing despite sound receive. Anyone eat summer lead soon property write. Fish sense kind spring throughout interview trade knowledge.,The ticket contains a series of disjointed phrases that do not clearly convey a specific issue or request. It appears to be a collection of unrelated thoughts rather than a coherent message.,Low,General Inquiry / Unclear Request
29,My indeed deal information toward once. Task she herself. Wall fear hope.,"The user appears to be expressing confusion or frustration regarding their ""Indeed deal information"" and may be seeking assistance with a task they are trying to complete. The mention of ""wall fear hope"" is unclear and may indicate emotional distress or uncertainty.","Low to Medium - While the user's message suggests some level of concern, the lack of specific details makes it difficult to assess the urgency accurately.",General Inquiry / Support Request - The ticket seems to relate to a request for help or clarification regarding a service or task.
30,Section national owner determine detail job ahead. Protect something right subject try wonder. Agree hour north agree poor career left.,"The ticket appears to express concerns about job details and responsibilities related to a national owner, along with a mention of career dissatisfaction and time management issues.",Low,Job-related Inquiry/Concerns
31,Deep force seven here sell story. Strong like see appear weight. Practice sit prepare senior wear.,The ticket contains a series of disjointed phrases that do not convey a clear issue or request. It appears to lack coherent context or specific information.,Low,Miscellaneous/Unclear Communication
36,Society behavior develop reality fill ok list. Gas you nearly goal law fill discover. Firm sea week real course.,"The ticket appears to contain fragmented thoughts and unclear statements regarding societal behavior, goals, and possibly a request for information or assistance related to these topics.",Low,General Inquiry / Clarification Needed
40,Personal enough ball dream necessary. Able late order fact.,"The ticket seems to express a need for a personal item related to a ""ball dream,"" possibly indicating a request for a specific product or service that is important to the user. There is also a mention of a late order, suggesting that the user may be facing a delay or issue with a recent purchase.","Medium - The phrase ""able late order fact"" implies that the user may be experiencing some urgency regarding their order, but the overall message lacks clear indicators of immediate distress.",Order Inquiry/Support - This ticket likely falls under inquiries related to order status or fulfillment issues.
42,Organization station TV keep light. Record wall matter management ball.,"The user is experiencing an issue with the organization station's TV, which appears to be continuously lit. They also mention a concern related to wall matter management, possibly indicating a problem with wall-mounted equipment or decor.","Medium - The issue with the TV may affect operations, but it is not an immediate emergency.",Technical Support / Equipment Issue
43,Page ago director purpose team onto. Yourself public especially. Several compare million.,"The ticket appears to be a fragmented message that lacks clear context or coherent information. It mentions a director, a team, and comparisons involving millions, but the intent is unclear.",Low - The message does not convey any immediate issues or urgent requests.,Communication/Clarification - The ticket likely requires clarification or further information to understand the user's needs.
44,Young job sport why. Girl four prove tax form really explain.,"The user is requesting clarification on a tax form related to a young job or sports program, possibly for a girl aged four.",Low,Tax Inquiry / Youth Programs
49,Thank them key moment lead reveal. That wide avoid sit enter perhaps. Power system system teacher here first. Their along attention piece TV young section.,"The ticket appears to express gratitude for a key moment related to a lead reveal, but the rest of the message is unclear and seems to contain fragmented thoughts about a power system, a teacher, and a TV section.",Low,General Inquiry / Feedback
51,Company participant him raise. Tree central leave effect effort act source.,The ticket appears to be a fragmented message regarding a company participant's involvement and possibly a request for action related to a central issue or source of effort.,Low (due to unclear context and lack of immediate actionable items),Communication/Clarification Needed
52,Available war write federal. Real lead few yourself table blood. Occur offer yeah far within probably.,The ticket contains fragmented and unclear statements that do not provide specific information about an issue or request.,Low,General Inquiry/Unclear Issue
53,Treat seat strategy. Simply discover soon despite couple. Question return process stuff pick.,"The user is inquiring about the return process for a product, possibly related to a seating strategy or arrangement.",Low,Return Process Inquiry
54,Small almost half capital travel.,"The ticket appears to be related to a travel request or inquiry, specifically mentioning ""small"" and ""almost half capital,"" which may imply a request for travel arrangements or information regarding a trip that is not fully capitalized or is of limited scope.",Low - The phrasing does not indicate an immediate need or urgency for assistance.,Travel Inquiry - This ticket likely falls under travel-related inquiries or requests.
55,Customer skill theory hand. Tree store either station loss southern second. Sound life away senior difficult put.,"The customer appears to be experiencing an issue related to a ""tree store"" and mentions ""station loss,"" which may indicate a problem with connectivity or service in a specific area. The phrasing suggests a level of frustration or difficulty with the situation.","Medium - The mention of ""station loss"" implies a potential service disruption that may need timely attention, but the overall message lacks specific details indicating an immediate crisis.","Connectivity Issue - The ticket likely pertains to a problem with service or connectivity, possibly related to a specific location or service area."
59,Similar small other everyone worker would. Economy company produce ago address so draw.,"The ticket contains a vague statement about a company and its workers, mentioning production and addressing an unspecified issue.",Low,General Inquiry/Feedback
63,Before be it season. Speech news only no form business. Them wait institution trouble anything explain.,"The user appears to be expressing frustration or confusion regarding a situation related to a speech or news event, possibly indicating that there is a lack of clarity or communication from an institution. They may be seeking an explanation or assistance regarding this issue.","Medium - The user's request for clarification suggests that they may need timely assistance, but the exact nature of the urgency is unclear.",Communication Issues / Clarification Needed
64,Medical choice lot suggest glass news boy. Off southern suddenly window stand.,The ticket contains a series of disjointed phrases that do not convey a clear issue or request. It seems to be a nonsensical or poorly constructed message.,Low,Miscellaneous/Unclear Communication
71,Senior service large under north play person. Firm key light place someone option goal avoid. Later arm story baby ten talk past.,"The ticket appears to contain fragmented and unclear statements, making it difficult to ascertain the specific issue or request. It mentions a ""senior service"" and references various unrelated terms such as ""north play,"" ""firm key,"" and ""baby ten talk.""",Low - The lack of clarity and specific details suggests that this may not be an urgent issue.,General Inquiry / Clarification Needed - The ticket requires further clarification to determine the exact nature of the request or problem.
74,Next poor foreign campaign reflect. Behavior provide meet adult final week game.,"The user is expressing dissatisfaction with a recent campaign, possibly related to a game, and is seeking feedback or reflection on its performance.",Low,User Feedback/Concerns
76,Return analysis hair rest. Particular sell six doctor dream whole. Tough create question now key show sing. Month whom stage soon catch economic political.,The ticket appears to be a fragmented and unclear message regarding a return analysis related to hair restoration products. It mentions a sale involving doctors and possibly a dream or aspiration related to the product. There are also vague references to economic and political factors.,Low (the message lacks clarity and does not indicate immediate urgency).,Product Inquiry/Return Request.
77,Represent middle by base. Evening town challenge join. Stage this us increase how.,"The ticket appears to be a request for assistance with a challenge or event related to a town or community, possibly requiring collaboration or participation in the evening. The phrasing is unclear, indicating a need for clarification.","Low to Medium - The urgency is not explicitly stated, but the mention of an evening challenge suggests a time-sensitive issue.",Event Participation / Community Engagement - This ticket likely falls under events or community-related inquiries.
78,Heart agreement us stuff. Social case expert stop receive catch. Large accept bad eight strong nature road.,"The ticket appears to be a fragmented and unclear message, possibly indicating issues related to a social case or agreement. The mention of ""social case expert"" suggests a need for assistance or intervention in a social matter.","Low to Medium - The urgency is not clearly defined due to the lack of coherent information, but it may require attention to clarify the situation.","Social Services - This ticket likely falls under social services or case management, given the reference to a social case expert."
82,Consider care respond want already cut social though. Value middle writer myself education send. Experience television answer pretty event.,"The ticket appears to express a desire for assistance related to social issues and education, mentioning a writer's experience in television and a request for a response.",Low,General Inquiry/Support Request
84,Language risk treatment past itself police. Avoid point guy song. Well central parent sit.,The ticket contains a series of disjointed phrases that do not convey a clear issue or request. It appears to be nonsensical or may require clarification.,Low - The lack of a coherent message suggests that this ticket may not represent an immediate concern.,Miscellaneous - The content does not fit into standard support categories and may need further investigation or clarification from the user.
88,Meeting building cut catch so ago. Occur level work candidate this assume huge.,The ticket appears to be a fragmented message regarding a meeting or event that may have been missed or affected by a significant issue.,Low (the message is unclear and does not indicate an immediate need for resolution).,Communication/Meeting Issues.
92,Marriage phone face. Lot source rate father authority. Citizen indeed less future. Fine responsibility safe team.,The ticket contains a series of disjointed phrases that do not convey a clear issue or request. It appears to be a collection of unrelated thoughts or keywords.,Low,Miscellaneous/Unclear Issue
93,Middle blood drop business last cell. Face his past.,"The ticket appears to reference a specific issue or task related to a ""middle blood drop"" in a business context, possibly involving a final cell or stage in a process. The phrase ""Face his past"" suggests there may be a need to address historical issues or challenges.","Low to Medium - The urgency is not clearly defined, but the mention of ""past"" may indicate a need for timely resolution to prevent future complications.","Business Process/Operations - This ticket likely falls under operational issues or process management, possibly related to data handling or project management."
94,Value return couple city you level. Market bed hotel lead drive.,"The ticket appears to be a fragmented request related to hotel accommodations in a city, possibly seeking information about market rates or availability for a couple.",Low (the message lacks specific details or immediate concerns).,Hotel Booking Inquiry
95,Example our successful.,"The ticket appears to be a vague statement or possibly a typo, lacking clear context or specific issues that need addressing.","Low, as there is insufficient information to determine any immediate concern or need for action.","General Inquiry/Clarification, as it seems the user may be seeking assistance but has not provided enough detail to categorize the request effectively."
97,Share evidence writer quite budget window hour. Newspaper hand certain own husband American. Case four listen.,"The ticket appears to be a fragmented request or statement involving a writer, a budget, and possibly a newspaper. It mentions a husband and listening to a case, but the context is unclear.",Low (the message lacks clarity and specific urgency indicators).,General Inquiry / Clarification Needed.
98,Cause use five hotel pattern successful order. Stock mother remember feel staff happy purpose. On someone rise read ago listen. Officer return on color pick people subject challenge.,"The ticket appears to express a positive experience related to a hotel stay, mentioning successful orders and happy staff. However, the language is somewhat unclear and fragmented, making it difficult to determine the exact issue or request.",Low – The tone suggests a positive experience rather than an urgent concern.,Customer Feedback / Experience
